{
  "authority": "nxb-v11-validation-toolchain-lock-v1",
  "schema_version": 1,
  "hosted_runner": {
    "label": "windows-2022",
    "architecture": "X64",
    "execution_class": "hosted-static"
  },
  "validation_host_powershell": {
    "version": "7.6.6",
    "architecture": "x64",
    "source_repository": "PowerShell/PowerShell",
    "release_id": 385023724,
    "release_tag": "v7.6.6",
    "asset_id": 551207033,
    "asset_name": "PowerShell-7.6.6-win-x64.zip",
    "asset_size_bytes": 106328873,
    "archive_expected_sha256": "02fe458be20493fbdf43f61ea20610b811ee6c738ab1676c61b9cfcd1a33c860",
    "bootstrap_tree_profile": "nxb-a0-host-powershell-bootstrap-tree-v1",
    "bootstrap_tree_sha256": "1111111111111111111111111111111111111111111111111111111111111111",
    "bootstrap_tree_file_count": 100,
    "bootstrap_tree_total_file_bytes": 1000000,
    "runtime_tree_profile": "nxb-artifact-tree-manifest-v1",
    "runtime_tree_sha256": "2222222222222222222222222222222222222222222222222222222222222222",
    "pwsh_relative_path": "pwsh.exe",
    "pwsh_exe_sha256": "3333333333333333333333333333333333333333333333333333333333333333"
  },
  "validation_host_python": {
    "version": "3.12.10",
    "architecture": "x64",
    "acquisition_profile": "setup-python-toolcache-v1",
    "source_package_provenance": {
      "source_repository": "actions/python-versions",
      "version": "3.12.10",
      "asset_name": "python-3.12.10-x64.zip",
      "source_identity": "https://github.com/actions/python-versions/releases/tag/3.12.10",
      "archive_sha256": "4444444444444444444444444444444444444444444444444444444444444444"
    },
    "expected_hosted_toolcache_identity": {
      "toolcache_relative_role": "Python/3.12.10/x64",
      "complete_marker_present": true,
      "python_executable_sha256": "5555555555555555555555555555555555555555555555555555555555555555",
      "bootstrap_tree_profile": "nxb-a0-host-python-bootstrap-tree-v1",
      "bootstrap_tree_sha256": "6666666666666666666666666666666666666666666666666666666666666666",
      "runtime_tree_profile": "nxb-artifact-tree-manifest-v1",
      "runtime_tree_sha256": "7777777777777777777777777777777777777777777777777777777777777777",
      "file_count": 200,
      "total_bytes": 2000000
    }
  },
  "powershell_runtime_admission_authority": "nxb-v11-powershell-runtime-admission-v2",
  "powershell_runtime_admission_receipt_sha256": "8888888888888888888888888888888888888888888888888888888888888888",
  "trusted_preparation_receipt_sha256": "9999999999999999999999999999999999999999999999999999999999999999",
  "powershell_module_lock_path": "validation/v11/locks/powershell-modules.lock.json",
  "powershell_module_lock_sha256": "aaaaaaaaaaaaaaaaaaaaaaaaaaaaaaaaaaaaaaaaaaaaaaaaaaaaaaaaaaaaaaaa",
  "selected_host_python_dependency_lock_path": "validation/v11/locks/validator-py312.lock",
  "selected_host_python_dependency_lock_sha256": "bbbbbbbbbbbbbbbbbbbbbbbbbbbbbbbbbbbbbbbbbbbbbbbbbbbbbbbbbbbbbbbb",
  "actions": [
    {
      "repository": "actions/checkout",
      "commit_sha": "3d3c42e5aac5ba805825da76410c181273ba90b1"
    },
    {
      "repository": "actions/setup-python",
      "commit_sha": "5fda3b95a4ea91299a34e894583c3862153e4b97"
    },
    {
      "repository": "actions/upload-artifact",
      "commit_sha": "ea165f8d65b6e75b540449e92b4886f43607fa02"
    }
  ],
  "action_pin_set_sha256": "3bd5b7957b1b599e40c5d7e7d6afebf755d2b4021d62fa316d016b4ff7eccf0b",
  "artifact_tree_contract": {
    "profile": "nxb-artifact-tree-manifest-v1",
    "schema_path": "schemas/nxb-artifact-tree-manifest.schema.json",
    "schema_sha256": "cccccccccccccccccccccccccccccccccccccccccccccccccccccccccccccccc",
    "implementation_path": "validation/v11/tools/build_artifact_tree_manifest.py",
    "implementation_sha256": "dddddddddddddddddddddddddddddddddddddddddddddddddddddddddddddddd",
    "canonical_wrapper_path": "validation/v11/scripts/ConvertTo-NxbV11CanonicalAuthority.ps1",
    "canonical_wrapper_sha256": "eeeeeeeeeeeeeeeeeeeeeeeeeeeeeeeeeeeeeeeeeeeeeeeeeeeeeeeeeeeeeeee"
  },
  "verified_archive_contract": {
    "profile": "nxb-v11-verified-archive-extraction-v1",
    "implementation_path": "validation/v11/scripts/Expand-NxbV11VerifiedArchive.ps1",
    "implementation_sha256": "ffffffffffffffffffffffffffffffffffffffffffffffffffffffffffffffff"
  }
}
